,Article_ID,Date,Source,Article
33,Batch 02 - BBC  - 2087,04 October 2024,BBC,"Iran's missile strikes on Israel were ""correct, logical, and lawful"", Ayatollah Ali Khamenei told a vast crowd which had gathered to hear him speak in Tehran on Friday. The country's supreme leader described the attack as the ""minimum punishment"" for what he called Israel's ""astonishing crimes"" while leading Friday prayers in the capital, something he has not done since 2020. Khamenei's speech came three days after Iran fired nearly 200 missiles at Israel, in what it said was retaliation for the assassination of Hezbollah’s leader, Hassan Nasrallah. The Farsi-speaking supreme leader delivered part of his speech in Arabic to address Palestinian and Lebanese supporters.  During his sermon, Khamenei praised Nasrallah and voiced support for Hamas and Hezbollah, which he said provided ""vital service to the entire region and the entire Islamic world"". He said Iran-aligned armed groups ""will not back down"" in their conflict with Israel, which entered a new phase after Hamas launched deadly raids into Israel almost one year ago.  Iran is the main backer of Hezbollah and Hamas, as well as other armed groups around the Middle East which have attacked Israel. They often dub themselves the ""Axis of Resistance"".  In recent weeks, several senior leaders of Iran-backed groups and Iran's powerful military wing, the Revolutionary Guards, have been killed in Israeli strikes or presumed Israeli assassinations. The supreme leader's appearance in front of a crowd of tens of thousands in Tehran is a sign of the gravity of the moment for the Iranian regime, which is facing widespread domestic discontent. It could be read as an attempt to show strength and restore Iran’s credibility as leader of the “Axis of Resistance”. The public appearance was also intended to show that Khamenei is not in hiding, after reports emerged that he had been taken to a secure location following Nasrallah's assassination. The Grand Mosalla Mosque was flooded with people after Iranians were given free transport to attend the sermon. A large Palestinian flag was seen in the crowd.  Khamenei holds ultimate power in Iran, but very rarely leads Friday prayers himself.    The last time he did was in 2020, after the US killed Iran's most senior military commander, Qassem Soleimani. The time before that was in 2012. Iran is still reeling from the loss of its allies Nasrallah and Hamas's political leader Ismail Haniyeh, who was assassinated in Tehran in July. Israel is widely considered to be behind Haniyeh's killing, though it has never commented on his death. Khamenei also told the crowd that Iran would retaliate if, as expected, Israel launches a response to Tuesday's missile attack. ""If we needed to do that again, we would do it again in the future,"" Khamenei told supporters.  On Thursday, US President Joe Biden suggested a possible Israeli strike on Iran's oil infrastructure had been discussed, as Israel continued to weigh up how to strike back at Tehran.  Copyright 2024 BBC. All rights reserved.  The BBC is not responsible for the content of external sites. Read about our approach to external linking.  "
34,Batch 01 - BBC  - 1317,28 July 2024,BBC,"Israel says it has hit Hezbollah targets in Lebanon after 12 children and young adults were killed in a rocket strike while playing football in the Israeli-occupied Golan Heights. The country's air force has blamed the Iran-backed militant group for Saturday's strike on the Druze town of Majdal Shams, but Hezbollah has strongly denied any involvement. Early on Sunday, the Israel Defense Forces (IDF) said it had conducted air strikes against seven Hezbollah targets ""deep inside Lebanese territory"". It is unclear whether there were any casualties. The rising tensions have the potential to trigger an all-out war between Israel and Hezbollah. Their forces have regularly exchanged fire since 7 October when Hamas attacked Israel, triggering Israel's military offensive on Gaza. Saturday's bloodshed at the town's football pitch was the deadliest loss of life in and around Israel's northern border since October.  Fighting between Israel and Hezbollah, which had previously been sporadic, escalated when the militant group fired rockets at Israeli positions the day after the Hamas attack, in solidarity with Palestinians.  Israel's foreign ministry released the identities of 10 children killed in Saturday's strike, saying they were aged between 10 and 16.  An eleventh person was named but no age was given. Details of the twelfth casualty were not confirmed. Verified video shows crowds of people on a football pitch and stretchers being rushed to ambulances.  Majdal Shams is one of four towns in the Golan Heights, where about 25,000 members of the Arabic-speaking Druze religious and ethnic group live. On Sunday, thousands of people gathered in the town for the funerals of those killed.  Hezbollah spokesman Mohamad Afif denied responsibility for Saturday's strike in the Golan Heights.  However, Israeli Prime Minister Benjamin Netanyahu vowed retaliation immediately after it happened, saying the group would ""pay a heavy price"".  Hours later, the Israeli Air Force (IAF) said it had struck ""terror targets"" including ""weapons caches and terrorist infrastructure"" overnight.  Before reports of the strike's impact emerged, Hezbollah had claimed responsibility for four other attacks.  One was on a nearby military compound on the slopes of Mount Hermon, which lies on the border between the Golan Heights and Lebanon.  The base is around 3km (2 miles) from the football pitch.  IDF spokesman Daniel Hagari, who visited the scene of the air strike, accused Hezbollah of ""lying and denying responsibility for the incident"".  He said that the rocket was an Iranian-made Falaq-1 ""owned exclusively by Hezbollah"". ""Our intelligence is clear,"" he said. ""Hezbollah is responsible for the murder of innocent children."" Sheikh Mowafaq Tarif, the leader of the Druze community in the area, said the ""horrific massacre"" had crossed ""every possible red line"".  Meanwhile, Iran warned Israel that any new military ""adventures"" in Lebanon could lead to ""unforeseen consequences"", said Nasser Kanani, a spokesperson for Iran's foreign ministry, according to AFP.  The air strike prompted Mr Netanyahu, who was visiting the United States, to return home early. His plane landed in Israel on Sunday.  International leaders condemned the strike and cautioned against escalation, but differed on who was responsible.  US Secretary of State Antony Blinken told reporters on Sunday: ""Every indication is that indeed the rocket was from Hezbollah."" He said the US stands by ""Israel's right to defend"" itself, but does not want to see the conflict spreading.  Lebanon's government also issued a rare statement in response to the strike, saying it ""condemns all acts of violence and aggression against all civilians and calls for an immediate cessation of hostilities on all fronts"".  ""Targeting civilians is a flagrant violation of international law and goes against the principles of humanity,"" the statement added.  The Lebanese Foreign Minister Abdallah Bouhabib told the BBC that he did not think Hezbollah carried out the attack. “I don’t think Hezbollah would do it”, he said, explaining the group usually hits military targets, not civilian targets. But he added “it could be a mistake by the Israelis or by Hezbollah – I don’t know”. ""We are talking with Hezbollah because the victims are Druze and the Druze community here [in Lebanon] cares about them a lot. We are asking Hezbollah not to retaliate at this present time”, Mr Bouhabib said.  A United Nations statement said ""maximum restraint"" was crucial from all parties as the risk of a wider conflict would ""engulf the entire region in a catastrophe beyond belief"". In Majdal Shams on Sunday, where bloodstains remained on the astroturf pitch, locals expressed grief, anger and worry.  Fighting back tears, Ugarit Abu Assad, 26, from nearby Buqata, told the BBC she feared a major escalation. “I’m afraid of the consequences of all out war,” she said, adding that ""a lot of people"" could die.  Most Druze live in northern Israel, Lebanon, Jordan and Syria. In Israel, they have full citizenship rights and comprise about 1.5% of the population. Those living in the Golan were offered Israeli citizenship when the region was annexed from Syria in 1981, but not everyone accepted. Druze in the Golan can still study and work in Israel, though only those with citizenship can vote. Male Israeli Druze are required to serve in the army. They are the largest non-Jewish group in the IDF. The vast majority of the international community does not recognise Israel's annexation of the Golan Heights. Additional reporting by Mallory Moench and Lucy Clarke-Billings Copyright 2024 BBC. All rights reserved.  The BBC is not responsible for the content of external sites. Read about our approach to external linking.  "
35,Batch 01 - BBC  - 558,11 March 2024,BBC,"A ship with humanitarian aid for Gaza remains docked in Cyprus, a day after it was due to begin its journey. A charity leading the mission told the BBC it was ""a quickly evolving and fluid situation"", but it hoped the ship, Open Arms, would set sail soon. On Sunday evening, the sighting of the new moon marked the start of the Islamic holy month of Ramadan in Gaza. A ceasefire remains off the table as indirect negotiations between Israel and Hamas have largely stalled. The UN has warned that famine in Gaza is ""almost inevitable"" and children are starving to death. Aid agencies and Western politicians say the best way to get the amount of aid needed into Gaza is by land.  Last week, UK Foreign Secretary Lord Cameron said the UK, US and EU were continuing to urge Israel ""to allow more trucks into Gaza as the fastest way to get aid to those who need it"". He also said Israel should open its container port at Ashdod, north of Gaza, to receive aid shipments from Cyprus until a sea corridor is up and running.  Israel denies impeding the entry of aid or its distribution inside Gaza, and blames UN agencies on the ground for failing to get the aid that is allowed in to the people who need it. The Open Arms mission is separate to US plans to start building a floating dock off the coast of Gaza to help get aid deliveries in by sea. A US military ship, the General Frank S Besson, set sail from a base in the state of Virginia on Saturday and is sailing towards the Middle East, carrying equipment to build a temporary pier that could allow large ships carrying aid to be unloaded. But the Pentagon has said it could take up to 60 days to build the pier with the help of 1,000 troops - none of whom would go ashore. The Open Arms meanwhile would be the first ship to sail from Cyprus to Gaza under a sea corridor plan announced by the EU, US and UK. The salvage vessel, still docked in the Cypriot port city of Larnaca, belongs to the Spanish charity of the same name.  The food is being supplied by the World Central Kitchen (WCK), a US charity founded by Spanish celebrity chef José Andrés. In a video posted from Larnaca's port on Monday morning, Juan Camilo of WCK said ""everything is ready"" for the ship to set sail. ""From this side we are ready to go and we have our team ready in Gaza to [distribute] this, what we hope is going to be the first of as many as possible trips to Gaza by sea,"" he said. The boat will tow a barge loaded with 200 tonnes of food, including rice, flour and cans of meat and fish. The voyage is expected to take about 50 hours. A spokesperson for WCK told the BBC the charity had started building a jetty on the Gaza coast to get the food to shore.  Some observers have been sceptical about plans to deliver aid by sea. Independent UN human rights expert Michael Fakhri said the US military operation to build a pier would not ""prevent starvation and famine by any definition"". As the humanitarian situation has become increasingly dire, several nations have turned to airdrops. On Friday, there were reports that five people had been killed by a falling aid package north of Gaza City, when its parachute failed to open properly. Aid trucks have been entering Gaza through the Rafah crossing with Egypt and the Kerem Shalom crossing with Israel, following stringent Israeli security checks on cargo.  But both crossings are in the south of Gaza, and the fighting and breakdown of social order have prevented convoys from reaching northern Gaza, where about 300,000 people are estimated to be living with very little food and water. Two Israeli-controlled crossing points in northern Gaza have been closed since Hamas gunmen attacked southern Israel on 7 October. In Gaza, Palestinians said they hoped the Islamic holy month of Ramadan could bring an end to war. ""We are now at a war that has eaten the rocks. the trees, the human, everything - there is nothing in Gaza,"" one man told the BBC's Gaza Lifeline radio service. A woman displaced from her home meanwhile said her family was making an effort to celebrate. ""We wanted to change for the children and make them happy, so we got lanterns and decorations in the tent. Can you imagine that we are decorating a tent?"" she said. On Sunday, US President Joe Biden said the suffering of Palestinians would be ""front of mind"" for him and many others as Ramadan came at ""a moment of immense pain"". UN Secretary General Antonio Guterres also marked the beginning of the holy month with a video message of ""solidarity and support to all those suffering from the horrors in Gaza"".  However Israeli Prime Minister Benjamin Netanyahu repeated his intent to send troops into Rafah in southern Gaza, where well over a million people have been displaced after following Israeli instructions to leave other parts of the strip. ""We'll go there. We're not going to leave them. You know, I have a red line. You know what the red line is? That 7 October doesn't happen again,"" he told Politico.  He said Israel had destroyed three-quarters of Hamas' fighting battalions and the remaining battles would not take more than two months. Israel's military launched an air and ground campaign in Gaza after Hamas's attacks on Israel on 7 October, in which about 1,200 people were killed and 253 others were taken hostage. More than 31,100 people have been killed in Gaza since then, the territory's Hamas-run health ministry says. Copyright 2024 BBC. All rights reserved.  The BBC is not responsible for the content of external sites. Read about our approach to external linking.  "
36,Batch 01 - BBC  - 1445,24 October 2023,BBC,"It's been three weeks since Hamas launched an unprecedented attack on Israel, killing 1,400 people. Israel has retaliated with intense bombing on the Gaza Strip, which the Hamas-run health ministry says has killed more than 5,000 people.  Western leaders have been visiting Israel to show their support for the country - and to ask Israeli leaders to adhere to international law and protect civilians in Gaza. A ground invasion of Gaza is expected, though there is no clear indication of when that might happen.  The situation on the ground remains fast-moving and complex. Our correspondents, many currently in the region, have attempted to bring some clarity to the picture by answering questions submitted by BBC readers - you can read their answers below. Richard Jones asks: What is the likelihood of a larger war in the Middle East and would that be of great concern to the Israelis? Paul Adams, our diplomatic correspondent, reporting from Jerusalem, says: It's clearly in the minds of everyone, and why a host of foreign leaders and diplomats have made their way to Israel over the past couple of weeks. The main focus of concern is along Israel's northern border, where exchanges of gunfire between Israeli forces and the powerful Lebanese Shia militia, Hezbollah, have escalated day by day. Israel has deployed troops and armour to the border and taken the precaution of evacuating tens of thousands of civilians from vulnerable communities. Hezbollah is backed by Iran, which has warned that it might have to intervene if the situation in Gaza continues to deteriorate. For Israel, Hezbollah's stock of sophisticated missiles represents a much greater potential threat than Hamas. The US has sent additional weaponry to Israel and deployed a carrier task force to the eastern Mediterranean as a powerful signal to Hezbollah and Iran. But while the violence of recent days is alarming, it doesn't yet seem as though Hezbollah has taken a definitive decision to join the fight. Caroline Kelly asks: Regarding Israel's blockade of Gaza over the last two weeks - does this mean that there is literally no water, fuel and electricity available to the people of Gaza? Middle East correspondent Tom Bateman, in Jerusalem, answers:  Israel said it was imposing a ""complete siege"" on Gaza. The energy minister Energy Minister Israel Katz said after Hamas's attacks there would be no supply of power or water until the hostages were released - calling this ""humanitarian for humanitarian"". Since 2006, Israel had already imposed a tight blockade, backed by Egypt, on Gaza after Hamas consolidated its grip on the territory. Israel said this was to stop weapons-making supplies getting in. But it meant life for ordinary citizens was made much tougher as Israel and Egypt controlled everything that went in and out; except for what reached Gaza via smuggling tunnels from Egypt. Now there's no access at all except for those few aid lorries getting over the border from Egypt since Saturday and Israel allowing piped water for a few hours a day in eastern Khan Younis. It means the only remaining sources of power and drinkable water inside Gaza are stocks from before this conflict - including private stores of diesel for generators (which can also power water filter systems in people's homes), remaining stocks of bottled water and private wells - this water is often polluted and needs to be filtered. From an anonymous emailer: How likely is it that Israel will be able to rescue the hostages taken by Hamas? Security Correspondent Frank Gardner says: Because of the very high number of hostages held in Gaza - more than 200 - the odds on Israel being able to rescue all of them by force are not good. As we know, two hostages were released last Friday after mediation by Qatar - and another two were released on Monday. The Qataris believe more could follow but some people are suggesting this could be a delaying tactic by Hamas to deter Israel from making its expected military incursion into Gaza. The Israelis have a lot of expertise in hostage rescue and their Special Forces unit, Sayaret Matkal, has trained intensively for just such an operation. But they face a tough challenge. Some or all of the hostages are likely to be held underground in tunnels and bunkers, in some cases being moved around from one secret location to another. If their captors thought their hostages were on the verge of being rescued they would quite possibly try to kill them first. So, any rescue operation will be immensely risky. Rosemary Maltus-Smith asks: Who started funding for Hamas historically? Who funds Hamas today? How do they fund Hamas? Yolande Knell, Middle East correspondent in Jerusalem, says: In its early days, Hamas was funded by some Palestinian expats and private donors, particularly in the Arab Gulf. Some Islamic charities also sent money. Those sources of funding became much more difficult after it was widely designated as a terrorist entity by the US, European Union and others. Importantly, Hamas now receives material and financial support from Iran. In recent years, with a dire economic situation in Gaza, Qatar - which has given aid to the Palestinian territory - has been allowed to help it pay the wages of its thousands of government workers. The US Treasury also says that Hamas has a secret international investment portfolio, which generates large sums though its assets, estimated to be worth hundreds of millions of dollars, with companies operating in Sudan, Algeria, Turkey, the United Arab Emirates and other countries. Mary Freeman asks: How many innocent lives need to be lost before the West calls for a ceasefire? Paul Adams says: The death toll so far is staggering. More than 1,400 Israelis killed and more than 5,000 Palestinians, Gaza's Hamas-run health ministry says. That's an appalling loss of life, even by the terrible standards of the decades-long conflict between Israel and the Palestinians. From my experience of previous rounds of violence, the West allows Israel time to punish Hamas before it starts calling for restraint, let alone a ceasefire. Western governments are generally sympathetic to Israel's desire to punish Hamas. But this latest war is different. Israel isn't setting out merely to punish Hamas (""mowing the grass"" as it has sometimes been dubbed in the past). This time, Israel is determined to eradicate the movement once and for all - politically and militarily. That's going to involve a great deal more human suffering, and judging by the West's support for Israel so far - notwithstanding Joe Biden's warning to Israel not to act out of blind rage - it seems that Israel will be able to pursue its objectives for some time before its allies say enough is enough. Alex in Cyprus wants to know whether there has been any indication from Fatah that they are willing to take over Gaza, which they lost to Hamas. Yolande Knell answers: So, some background first: Fatah is the secular political faction which is the main rival to Hamas. The Fatah leader is President Mahmoud Abbas who heads the Palestinian Authority (PA) which governs parts of the occupied West Bank. He is also the chair of the Palestine Liberation Organisation (PLO) - which is the umbrella group that is internationally recognised as representing the Palestinian people. Hamas and Islamic Jihad are not part of the PLO, which has been the negotiator in past rounds of direct peace talks with Israel. The PA governed Gaza but Hamas took full control there in 2007, ousting PA security forces in bloody street battles. This was a year after Hamas won parliamentary elections. We saw the US Secretary of State Antony Blinken meeting President Abbas when he rushed to the region after the war started in Gaza. Last week, I met Sabri Saidam, a former PA minister, who is a senior Fatah official and close to Abbas. I asked him whether the PA was being urged to return to Gaza after this war. He told me: ""Israel wants to discuss the future, America wants to discuss the future. The Palestinian leadership is quite clear - it feels strongly about it. It will not come to control Gaza and the people of Gaza on the back of an Israeli tank."" Do Western governments have a red line for Israel in this conflict, asks Sam. Frank Gardner replies: If they do then we have heard very little about it. There is also no one single unified ""Western position"" on this conflict in the way that there has been within Nato over the full-scale Russian invasion of Ukraine last year. The sheer savagery and cruelty of Hamas's attack on civilians in southern Israel on 7 October meant that many Western leaders rushed to offer Israel their full support. However, as Israel's retaliatory air strikes have subsequently pummelled Gaza, causing appallingly high civilian casualties, there are growing misgivings amongst Israel's friends that the Netanyahu government is going too far. ""Don't be blinded by anger in the way we were in the US after 9/11"" is the message President Biden gave Israel during his brief visit there last week. All Western leaders have called on Israel not to breach international humanitarian law, yet that is exactly what UN agencies are now accusing Israel of doing as it bombs crowded areas and forces more than a million people out of their homes. Copyright 2024 BBC. All rights reserved.  The BBC is not responsible for the content of external sites. Read about our approach to external linking.  "
